,Passage
1611,largest minority language Swedish second official language Finland spoken 55 percent population minority languages Russian 08 percent Estonian 03 percent north Lapland also Sami people numbering around 7000 According Finnish Population Registry Center Finnish Sami parliament Sami population living Finland 7371 2003 See Regional division Sami people Finland age 2003 Finnish recognized indigenous people quarter speaks Sami language mother tongue three Sami languages spoken Finland Northern Sami Inari Sami Skolt Sami Unofficial names Finland Sami languages Suopma Northern Sami SuomÃ Inari Sami LÃÃÂddjÃnnam Skolt Sami See minority languages Finnish Romani Finnish Sign Language spoken natively 4000â5000 people ref FinlandSwedish Sign Language spoken natively 150 people rights minority groups particular Sami Romani people cherish culture language protected constitution
1612,majority Finns learn enough English school media proficient language common foreign languages studied German French Education national language compulsory junior high school Finnish Swedish speakers exception autonomous Ã land Islands Finnish compulsory due Swedish sole official language province
1613,Helsinki Cathedral statue Emperor Alexander II Russia
1614,Finns members Evangelical Lutheran Church Finland 825 percent minority belongs Finnish Orthodox Church 11 percent see Eastern Orthodox Church Protestant denominations Roman Catholic Church Finland significantly smaller Muslim Jewish nonChristian communities totaling 12 percent 151 percent population unaffiliated main Lutheran Orthodox churches national churches Finland Church attendance much lower figures may suggest population holds generally secular views majority members state Lutheran Church participate actively often attending church special occasions like weddings funerals
1615,According 2005 Eurobarometer Poll 41 percent Finnish citizens responded believe god whereas 41 percent answered believe sort spirit life force 16 percent believe sort spirit god life force
1616,Finnish family life centered nuclear family Relations extended family often rather distant Finnish people form politically significant clans tribes similar structures According UNICEF Finland ranks fourth child wellbeing
1617,Auditorium Helsinki University Technologys main building designed Alvar Aalto
1618,Finnish education system comparatively egalitarian Nordic system tuition fees fulltime students Attendance compulsory ages 7 16 free meals served pupils primary secondary levels first nine years education primary secondary school compulsory pupils go local school Secondary education compulsory either trade school preparation tertiary education tertiary education two mostly separate noninteroperating sectors found higher vocational schools universities
1619,OECDs international assessment student performance PISA Finland consistently among highest scorers worldwide 2003 Finnish 15yearolds came first reading literacy science mathematics second problem solving worldwide World Economic Forum ranks Finlands tertiary education 1 world
1620,Finland developed public health care system 189 percent health care funded households 766 percent publicly funded rest funding comes elsewhere 307 residents doctor
1621,one highest death rates heart disease world 1970s improvements Finnish diet exercise paid Finland also boasts lowest smoking rate country European Union Finland one fittest countries world
1622,life expectancy 82 years women 75 years men
1623,Eduskuntatalo main building Parliament Finland Eduskunta Helsinki
1624,Finland semipresidential system parliamentarism president responsible foreign policy outside European Union cooperation cabinet Finnish Council State executive power lies headed Prime Minister Responsibility forming cabinet granted person nominated President approved Parliament person also becomes Prime Minister formal appointment President minister cabinet whole however must continuing trust parliament may voted resign replaced Council State made Prime Minister ministers various departments central government well exofficio member Chancellor Justice
1625,200member unicameral parliament called Eduskunta Finnish Riksdag Swedish supreme legislative authority Finland parliament may alter Constitution Finland bring resignation Council State override presidential vetoes acts subject judicial review Legislation may initiated Council State one Eduskunta members elected fouryear term basis proportional representation open list multimember districts
1626,state flag Finland
1627,judicial system Finland divided courts regular civil criminal jurisdiction administrative courts responsibility litigation individuals administrative organs state communities Finnish law codified based Swedish law wider sense civil law Roman law court system consists local courts regional appellate courts Supreme Court administrative branch justice consists administrative courts Supreme Administrative Court addition regular courts special courts certain branches administration also High Court Impeachment criminal charges offence office President Republic justices supreme courts members Council State Chancellor Justice Ombudsman Parliament
1628,parliament since equal common suffrage introduced 1906 dominated secular Conservatives Centre Party former Agrarian Union Social Democrats approximately equal support represent 65â80 percent voters 1944 Communists factor consider decades relative strengths parties vary slightly elections due proportional election multimember districts visible longterm trends
1629,Like Netherlands United Kingdom Finland constitutional court courts may strike laws pronounce constitutionality principle constitutionality laws Finland verified simple vote parliament However constitutional committee parliament reviews legistlation lawmaking process thus performs similar role
1630,According Transparency International Finland lowest level corruption countries studied survey last several years Also according World Audit study Finland least corrupt democratic country world 2006
1631,2007 Worldwide Press Freedom Index Reporters Without Borders ranked Finland along Belgium Sweden 5th 169 countries
1632,current President Finland Tarja Halonen state visit Brazil October 2003
1633,President Finland Head State Finland Constitution Finland executive power vested President government President possessing extensive powers President elected directly people term six years Since 1991 President elected two consecutive terms President must nativeborn Finnish citizen office established Constitution Act 1919
1634,current officeholder President Tarja Halonen began first term office 2000 reelected January 29 2006 current term expires 2012 eleventh President Finland first woman first capital Helsinki hold office
1635,Prime Minister Finland Matti Vanhanen eight days prior Finnish parliamentary election 2007
1636,Finnish Parliament consists one chamber two hundred members members elected fouryear term direct popular vote system proportional representation According Constitution Finland Parliament elects Prime Minister appointed office President Ministers appointed President Prime Ministers proposal current Prime Minister Finland well Chairman Centre Party Matti Vanhanen second half 2006 President European Council
1637,parliamentary elections March 18 2007 seats divided among eight parties follows
1638,collapse Soviet Union 1991 Finland freed last restrictions imposed Paris peace treaties 1947 FinnoSoviet Agreement Friendship Cooperation Mutual Assistance restrictions included therein annulled Finland recognised Russian Federation successor USSR quick draft bilateral treaties goodwill well reallocating Soviet debts
1639,Finland deepened participation European integration joining European Union Sweden Austria 1995 could perhaps said countrys policy neutrality moderated military nonalignment emphasis maintaining competent independent defence Peacekeeping auspices United Nations years real extranational military responsibility Finland undertook Since 2006 Finland participated formation European Union Battlegroups
1640,President leads Finnish foreign policy implemented Ministry Foreign Affairs current Minister Foreign Affairs Ilkka Kanerva Matters related European Union usually considered part foreign policy
1641,Finlands foreign policy based membership European Union customs union military nonalliance neutrality Finland also Nordic Council long traditions cooperation Nordic countries Finland good relations neighbours Sweden Norway Russia Estonia involved international conflicts border disputes
1642,military doctrine strictly selfdefensive indeed Constitution Finland allows participation military operations authorised UN OSCE Public opinion joining military alliances NATO although Finland involved Partnership Peace programme NATO Foreign trade highly important third gross domestic product comes foreign trade Finland depends imports raw materials
1643,Virtually every conscript Finnish Defence Forces given skitraining
1644,Finnish Defence Forces cadre army 16500 8700 professional soldiers officers standard readiness strength 34700 people uniform 27300 Army 3000 Navy 4400 Air Force Finlands defence budget equals 14 percent GDP universal male conscription place men 18 years age serve six nine twelve months Inhabitants Finlands Ã land Islands Jehovahs Witnesses exempt general exemptions Nonmilitary service thirteen months also possible Since 1995 Finnish women able military service volunteers defence based large trained reserve Cold War Finland could mobilised 490000 reservists conflict number since reduced 350000 due ongoing budget cuts
1645,Finnish Defence Forces command Chief Defence directly subordinate President Republic matters related military command current Chief Defence Admiral Juhani Kaskeala
1646,military branches Finnish Army Finnish Navy Finnish Air Force Border Guard Ministry Interior incorporated Defence Forces required defence readiness
1647,Ministry Trade Industry responsible Governments energy policy Energy policy exceptional importance Finland needs lot energy cold climate structure industry fossil fuel energy resources like oil coal thus done pioneering work developing efficient ways using energy Also Finland refines oil export 36 percent chemical exports cover domestic needs Finnish corporation Neste Oil two oil refineries Finland connected Nordpool Nordic electricity market
1648,1960s Finnish energy policy relied electricity produced hydropower stations extensive decentralised use wood energy Finlands 187888 lakes lie much sea level â less 80 metres case two biggest lakes Saimaa PÃijÃnne Consequently Finland less hydropower capacity Sweden Norway
1649,Olkiluoto Nuclear Power Plant two existing units third unit Finlands fifth far left computer manipulated ready 2011
1650,Finland started planning introduction nuclear power 1950s 2001 eighteen percent electricity consumed Finland produced countrys four nuclear power plants Energy policy became burning issue Finland industry applied permission build new nuclear power unit countrys fifth May 24 2002 Parliament supported application 107 votes 92 vote Green League resigned government held environment portfolio parties divided nuclear issue fifth nuclear power station â worlds largest 1600 MWe â currently construction scheduled operational 2011 built Frances AREVA Germanys Siemens AG general elections held March 18 2007 two Finnish energy groups Fortum Teollisuuden Voima TVO started environmental impact assessment EIA process concerning sixth nuclear power plant unit
1651,energy produced fossil fuels mainly coal oil Fossil fuels however imported Finland doesnt fossil fuel sources unlike neighboring Norway oil Estonia oil shale Nevertheless Finland fares exceptionally well renewable energy 25 percent energy renewable high compared EU average 10 percent one fifth energy consumed Finland woodbased remnant old ages pulp paper industry Finlands thirdlargest industry burns byproducts black liquor residues waste wood chippings resulting net production energy Many homeowners also renewed forests use wood additional primary heat source seven percent electricity produced peat harvested Finlands extensive bogs Peat bioenergy consensus whether renewable carbon neutral
1652,Currently electricity imported Finland recent years varying amount 5â17 percent power imported Russia Sweden Norway Norwegian Swedish hydroelectric plants remain important source imported power current energy policy debate centred selfsustainability plans build submarine power cable Russia also considered national security issue government already rejected one plan power cable
1653,Headquarters Nokia Finlands largest company
1654,Finland highly industrialised freemarket economy per capita output equal western economies Sweden UK France Germany largest sector economy services 657 percent followed manufacturing refining 314 percent Primary production low 29 percent reflecting fact Finland resourcepoor country respect foreign trade key economic sector manufacturing largest industries electronics 216 percent machinery vehicles engineered metal products 211 percent forest industry 131 percent chemicals 109 percent International trade important exports equalling almost onethird GDP Except timber several minerals Finland depends imports raw materials energy components manufactured goods
1655,northern climate agricultural development limited maintaining selfsufficiency Forestry important export earner provides secondary occupation rural population
1656,Finland one eleven countries joining euro monetary system EMU January 1 1999 national currency markka FIM use since 1860 withdrawn replaced euro EUR beginning 2002 see Finnish euro coins
1657,World Economic Forum declared Finland competitive country world three consecutive years 2003â2005 four times since 2002 recent years national focus innovation research development special emphasis information technology Nokia telecommunications company generally regarded single significant cause Finlands success
1658,Finnish trade relationships politics large determined avoidance provoking first feudally ruled Imperial Russia totalitarian Soviet Union However peaceful relationship Soviet Union Western powers turned economic advantage Soviet Union conducted bilateral trade Finland Western countries remained Finlands main trading partners Second World War growth rate GDP high compared Europe Finland often called Japan North beginning 1970s Finlands GDP per capita reached level Japan UK
1659,1991 Finland fell severe depression caused economic overheating depressed foreign markets dismantling barter system Finland former Soviet Union twenty percent Finnish trade Soviet Union 1991 following two years trade practically ceased growth 1980s based debt defaults began rolling avalanche effect increased unemployment virtual full employment one fifth workforce However civil order remained state alleviated problem funding welfare state taking massive debts 1991 1992 Finland devalued markka promote export competitiveness helped stabilise economy depression bottomed 1993 continued growth 1995 Since growth rate one highest OECD countries national debt reduced 411 percent GDP fulfilling EUs Stability Growth Pact requirement Unfortunately unemployment persistent currently 7 percent
1660,339 metres long MS Freedom Seas sister ship MS Liberty Seas built Aker Yards Perno Turku largest cruise ships passenger vessels world
1661,Notable Finnish companies include Nokia market leader mobile telephony Stora Enso largest paper manufacturer world Neste Oil oil refining marketing company UPMKymmene third largest paper manufacturer world Aker Finnyards manufacturer worlds largest cruise ships Royal Caribbeans Freedom Seas KONE manufacturer elevators escalators WÃrtsilÃ producer power plants ship engines Finnair countrys international airline
1662,HelsinkiVantaa Airport main airport Helsinki Metropolitan Region whole Finland
1663,Finlands transport network developed 2005 countrys network main roads total length 13258 km mainly centred capital city Helsinki total length public roads 78186 km 50616 km paved motorway network still great extent development currently totals 653 km 5865 km railways country Helsinki urban rail network light rail systems currently planned Turku Tampere Finland also considerable number airports large ports
1664,national railway company VR Valtion Rautatiet State Railways offers InterCity express trains throughout country faster Pendolino trains connecting major cities large discounts usually fifty percent available children 7â16 yr students senior citizens conscripts international trains St Petersburg Finnish Russian daytime trains Moscow Russian overnight train Russia Connections Sweden bus due rail gauge differences possible take
1665,EckerÃ Line ferries Helsinki Tallinn Estonia EckerÃ Grisslehamn Sweden
1666,25 airports Finland scheduled passenger services Finnair Blue1 Finncomm Airlines provide air services domestically internationally HelsinkiVantaa Airport Finlands global gateway scheduled nonstop flights places Bangkok Beijing Delhi Guangzhou Mumbai Nagoya New York Osaka Shanghai Hong Kong Tokyo Helsinki optimal location great circle airline traffic routes Western Europe Far East Hence many foreign tourists visit Helsinki stopover flying Asia Europe vice versa
1667,MS Silja Symphony leaving Helsinki Cruises popular tourist activity throughout Finland
1668,Tourism expanding industry Finland recent years become significant aspect economy 2005 Finnish tourism grossed â67 billion five percent increase previous year Much sudden growth attributed globalisation modernisation country well rise positive publicity awareness many attractions Finland attracted 4 million visitors 2005
1669,Finnish landscape covered thick pine forests rolling hills complemented labyrinth lakes inlets Much Finland pristine virgin contains 35 national parks Southern shores Gulf Finland high fells Lapland also urbanised region many cultural events activities
1670,Commercial cruises major coastal port cities Baltic region including Helsinki Turku Tallinn Stockholm TravemÃ¼nde play significant role local tourism industry
1671,Although many tourists visit ideal weather summer winter also attracts hundreds thousands Christmas festivities winter sports activities skiing dog sledding Nordic walking Finland regarded home Saint Nicholas Santa Claus Santaâs Post Office also located Finland northern Lapland region Arctic Circle polar night period sun doesnt rise days weeks even months Lapland extreme north Finland far north Aurora Borealis atmospheric fluorescence seen regularly winter exquisite spectacle draws people around globe particularly Japan
1672,Throughout summer range international festivals markets performing arts including song dance receding snow everlasting sunlight also provide opportunity array outdoor activities activities range golf fishing yachting lake cruises hiking kayaking among many others Finlands northernmost point heart summer Sun completely set 73 consecutive days Wildlife abundant Finland Birdwatching popular fond flying fauna however hunting also popular Elk reindeer hare common game Finland sport highly regulated also helps economy
1673,Finland also place rich culture history tradition religion churches cathedrals scattered across Finland reflecting strong Finnish Lutheran following also museums examples ancient architecture remaining reign Swedish Empire much Finland sites allure thousands significance historical insight Castles Swedish reign found example Turku HÃmeenlinna Savonlinna Turku Castle museum Olavinlinna Savonlinna hosts annual Savonlinna Opera Festival capital city Helsinki hand famous Grand Duchy era architecture resembles imperial St Petersburg
1674,Chimneyless sauna building Enonkoski Strong Finnish sauna culture one remains aboriginal Finnish culture
1675,Like people Finnish culture indigenous prominently represented Finnish language Throughout areas prehistory history cultural contacts influences concurrently varying times come directions result 600 years Swedish rule Swedish cultural influences still notable Today cultural influences North America prominent twentyfirst century many Finns contacted cultures distantly abroad Asia Africa Beyond tourism Finnish youth particular increasing contact peoples outside Finland travelling abroad work study
1676,still differences regions especially minor differences accents vocabulary Minorities Sami Finland Swedes Romani Tatar maintain cultural characteristics Many Finns emotionally connected countryside nature urbanisation relatively recent phenomenon
1677,Finland comfortably first Eurovision Dance Contest September 2007
1678,Though Finnish written language could said exist since Mikael Agricola translated New Testament Finnish sixteenth century result Protestant Reformation notable works literature written nineteenth century saw beginning Finnish national Romantic Movement prompted Elias LÃnnrot collect Finnish Karelian folk poetry arrange publish Kalevala Finnish national epic era saw rise poets novelists wrote Finnish notably Aleksis Kivi Eino Leino
1679,Finland became independent rise modernist writers famously Mika Waltari Frans Eemil SillanpÃÃ awarded Nobel Prize Literature 1939 far one Finnish author second World War prompted return national interests comparison international line thought characterized VÃinÃ Linna Literature modern Finland healthy state detective stories enjoying particular boom popularity Ilkka Remes Finnish author thrillers popular
1680,architect couple Aino Alvar Aalto
1681,Finns made major contributions handicrafts industrial design Finlands bestknown sculptor twentieth century WÃinÃ Aaltonen remembered monumental busts sculptures Finnish architecture famous around world Among top twentieth century Finnish architects win international recognition Eliel Saarinen designer widely recognised Helsinki Central railway station many public works son Eero Saarinen Alvar Aalto helped bring functionalist architecture Finland also famous work furniture glassware
1682,Much music Finland influenced traditional Karelian melodies lyrics comprised Kalevala Karelian culture perceived purest expression Finnic myths beliefs less influenced Germanic influence contrast Finlands position East West Finnish folk music undergone roots revival recent decades become part popular music
1683,Sami music
1684,people northern Finland Sweden Norway Sami known primarily highly spiritual songs called Joik word sometimes refers lavlu vuelie songs though technically incorrect
1685,Finnish composer Jean Sibelius 1865â1957 significant figure history classical music
1686,first Finnish opera written German composer Fredrik Pacius 1852 Pacius also wrote MaammeVÃrt land Land Finlands national anthem 1890s Finnish nationalism based Kalevala spread Jean Sibelius became famous vocal symphony Kullervo soon received grant study runo singers Karelia continued rise first prominent Finnish musician 1899 composed Finlandia played important role Finland gaining independence remains one Finlands popular national figures symbol nation
1687,Today Finland lively classical music scene Finnish classical music existed hundred years many important composers still alive Magnus Lindberg Kaija Saariaho Aulis Sallinen Einojuhani Rautavaara composers accompanied large number great conductors Sakari Oramo Mikko Franck EsaPekka Salonen Osmo VÃnskÃ JukkaPekka Saraste Susanna MÃlkki Leif Segerstam internationally acclaimed Finnish classical musicians Karita Mattila Soile Isokoski Kari Kriikku Pekka Kuusisto RÃka Szilvay Linda Brava
1688,Modern Finnish popular music includes renowned heavy metal scene common Nordic countries well number prominent rock bands jazz musicians hip hop performers dance music acts Bomfunk MCs Darude Finnish electronic music SÃhkÃ Recordings record label enjoys underground acclaim IskelmÃ coined directly German word Schlager meaning hit traditional Finnish word light popular song Finnish popular music also includes various kinds dance music tango style Argentinean music also popular One productive composers popular music Toivo KÃrki famous singer Olavi Virta 1915â1972 Among lyricists Sauvo Puhtila born 1928 Reino Helismaa died 1965 Veikko Vexi Salmi remarkable authors composer bandleader Jimi Tenor well known brand retrofunk music
1689,Notable Finnish dance music artists include Bomfunc MCs Darude JS16 DJ Orkidea
1690,Amorphis Children Bodom Impaled Nazarene Lordi Nightwish Sentenced Sonata Arctica Stratovarius Tarja Turunen 69 Eyes Negative Best Finnish Act MTV Europe Music Awards 2007 Negative Best Finnish Act European MTV Awards 2007 success European Japanese heavy metal hard rock scenes since 1990s gaining popularity rapidly United States since late 1990s later 1990s cello metal group Apocalyptica played Metallica cover versions cello quartettos sold half million records worldwide recently retired Timo Rautiainen Trio Niskalaukaus one Finlands popular metal acts early 2000s
1691,Arguably one Finlands domestically popular rock groups CMX Although group widely known outside country bassist Billy Gould popular US rock group Faith produced CMXs 1998 album Vainajala Ravelin Antti CMX Biography AOL Music
