,Passage
2331,Northern Canadian vegetation tapers coniferous forests tundra finally Arctic barrens far north northern Canadian mainland ringed vast archipelago containing worlds largest islands
2332,Average winter summer high temperatures across Canada vary depending location Winters harsh many regions country particularly interior Prairie provinces experience continental climate daily average temperatures near â15 ÂC 5 ÂF drop â40 ÂC â40 ÂF severe wind chills noncoastal regions snow cover ground almost six months year north Coastal British Columbia exception enjoys temperate climate mild rainy winter
2333,east west coast average high temperatures generally low 20s ÂC 70s ÂF coasts average summer high temperature ranges 25 30 ÂC 75 85 ÂF occasional extreme heat interior locations exceeding 40 ÂC 104 ÂF complete description climate across Canada see Environment Canadas Website
2334,Canadian banknotes depicting top bottom Wilfrid Laurier John Macdonald Queen Elizabeth II William Lyon Mackenzie King Robert Borden
2335,Canada one worlds wealthiest nations high per capita income member Organisation Economic Cooperation Development OECD Group Eight G8 Canada free market economy slightly government intervention United States much less European nations Canada traditionally lower per capita gross domestic product GDP southern neighbour whereas wealth equally divided higher large western European economies Since early 1990s Canadian economy growing rapidly low unemployment large government surpluses federal level Today Canada closely resembles US marketoriented economic system pattern production high living standards October 2007 Canadas national unemployment rate 59 lowest 33 years Provincial unemployment rates vary low 36 Alberta high 146 Newfoundland Labrador
2336,past century growth manufacturing mining service sectors transformed nation largely rural economy one primarily industrial urban first world nations Canadian economy dominated service industry employs three quarters Canadians However Canada unusual among developed countries importance primary sector logging oil industries two Canadas important
2337,Canada one developed nations net exporter energy Atlantic Canada vast offshore deposits natural gas large oil gas resources centred Alberta vast Athabasca Tar Sands give Canada worlds second largest reserves oil behind Saudi Arabia Quebec British Columbia Newfoundland Labrador Ontario Manitoba hydroelectric power cheap clean source renewable energy
2338,Canada one worlds important suppliers agricultural products Canadian Prairies one important suppliers wheat canola grains Canada worlds largest producer zinc uranium world leader many natural resources gold nickel aluminum lead many towns northern part country agriculture difficult exist nearby mine source timber Canada also sizeable manufacturing sector centred southern Ontario Quebec automobiles aeronautics representing particularly important industries
2339,Canada highly dependent international trade especially trade United States 1989 CanadaUS Free Trade Agreement FTA 1994 North American Free Trade Agreement NAFTA included Mexico touched dramatic increase trade economic integration US Since 2001 Canada successfully avoided economic recession maintained best overall economic performance G8 Since mid 1990s Canadas federal government posted annual budgetary surpluses steadily paid national debt
2340,Toronto Ontario skyline CN tower Toronto Canadas populous metropolitan area 5113149 people
2341,Canadas 2006 census counted 31612897 increase 54 since 2001 Population growth immigration lesser extent natural growth threequarters Canadas population lives within 150 kilometres 90 mi US border similar proportion live urban areas concentrated Quebec CityWindsor Corridor notably Greater Golden Horseshoe anchored around Toronto Montreal Ottawa environs BC Lower Mainland Vancouver environs CalgaryEdmonton Corridor Alberta
2342,According 2001 census 34 ethnic groups least one hundred thousand members 83 total population claiming white Ethnic diversity Canada
2343,largest ethnic group English 202 followed French 158 Scottish 140 Irish 129 German 93 Italian 43 Chinese 37 Ukrainian 36 First Nations 34 40 respondents identified ethnicity Canadian Canadas aboriginal population growing almost twice fast Canadian average 2001 134 population belonged nonaboriginal visible minorities
2344,2001 49 Vancouver population 428 Torontos population visible minorities March 2005 Statistics Canada projected people nonEuropean origins constitute majority Toronto Vancouver 2012 Canadian People Learn Canadas People According Statistics Canadas forecasts number visible minorities Canada expected double 2017 Roughly one every five people Canada could member visible minority 2017 Visible majority 2017
2345,Canada highest per capita immigration rate world driven economic policy family reunification Canada also accepts large numbers refugees Newcomers settle mostly major urban areas Toronto Vancouver Montreal 1990s 2000s almost Canadaâs immigrants came Asia Inflow foreignborn population country birth year
2346,Support religious pluralism important part Canadas political culture According 2001 census 771 Canadians identified Christians Catholics make largest group 436 Canadians largest Protestant denomination United Church Canada 165 Canadians declare religious affiliation remaining 63 affiliated religions Christianity largest Islam numbering 19 followed Judaism 11
2347,Canadian provinces territories responsible education system similar reflecting regional history culture geography mandatory school age ranges 5â7 16â18 years contributing adult literacy rate 99 Postsecondary education also administered provincial territorial governments provide funding federal government administers additional research grants student loans scholarships 2002 43 Canadians aged 25 64 postsecondary education aged 25 34 postsecondary attainment reaches 51
2348,Kwakwakawakw totem pole traditional big house Victoria BC
2349,Canadian culture historically influenced British French Aboriginal cultures traditions also influenced American culture proximity migration two countries American media entertainment popular dominant Canada conversely many Canadian cultural products entertainers successful US worldwide Many cultural products marketed toward unified North American global market
2350,creation preservation distinctly Canadian culture supported federal government programs laws institutions Canadian Broadcasting Corporation CBC National Film Board Canada NFB Canadian Radiotelevision Telecommunications Commission CRTC
2351,Canada geographically vast ethnically diverse country cultural variations distinctions province province region region Canadian culture also greatly influenced immigration world Many Canadians value multiculturalism see Canadian culture inherently multicultural Multicultural heritage enshrined Section 27 Canadian Charter Rights Freedoms
2352,Royal Canadian Mounted Police seen Expo 67 federal national police force Canada international icon
2353,National symbols influenced natural historical First Nations sources Particularly use maple leaf Canadian symbol dates back early 18th century depicted current previous flags penny coat arms prominent symbols include beaver Canada goose common loon Crown RCMP
2354,Canadas official national sports ice hockey winter lacrosse summer Hockey national pastime popular spectator sport country popular sport Canadians play 165 million active participants 2004 Canadas six largest metropolitan areas Toronto Montreal Vancouver Ottawa Calgary Edmonton franchises National Hockey League NHL Canadian players league countries combined hockey popular spectator sports include curling football latter played professionally Canadian Football League CFL Golf baseball skiing soccer volleyball basketball widely played youth amateur levels professional leagues franchises widespread
2355,Canada hosted several highprofile international sporting events including 1976 Summer Olympics 1988 Winter Olympics 2007 FIFA U20 World Cup Canada host country 2010 Winter Olympics Vancouver Whistler British Columbia
2356,population Montreal Quebec mainly Francophone significant Anglophone community
2357,Canadas two official languages English French Official Bilingualism Canada law defined Canadian Charter Rights Freedoms Official Languages Act Official Language Regulations applied Commissioner Official Languages English French equal status federal courts Parliament federal institutions public right sufficient demand receive federal government services either English French official language minorities guaranteed schools provinces territories
2358,English French mother tongues 597 232 population respectively languages spoken home 683 223 population respectively 985 Canadians speak English French English 675 French 133 177 English French Official Language Communities defined First Official Language Spoken constitute 730 236 population
2359,Although 85 Frenchspeaking Canadians live Quebec substantial Francophone populations Ontario Alberta southern Manitoba Acadian population northern southeastern parts New Brunswick constituting 35 provinces population well concentrations Southwestern Nova Scotia Cape Breton Island Ontario largest Frenchspeaking population outside Quebec Charter French Language Quebec makes French official language Quebec New Brunswick province statement official bilingualism constitution provinces official languages French used language instruction courts government services addition English Manitoba Ontario Quebec allow English French spoken provincial legislatures laws enacted languages Ontario French legal status fully coofficial Several aboriginal languages official status Northwest Territories Inuktitut majority language Nunavut one three official languages territory
2360,Nonofficial languages important Canada 5202245 people listing one first language significant nonofficial first languages include Chinese 853745 firstlanguage speakers Italian 469485 German 438080 Punjabi 271220
2361,tags
2362,Origin history name
2363,History
2364,Government law
2365,Foreign relations military
2366,Provinces territories
2367,Geography climate
2368,Economy
2369,Demography statistics
2370,Language
2371,Culture
2372,Similar publication online
2373,Government
2374,Crown corporations
2375,
2376,Beetles group insects largest number species placed order Coleopterawhich means sheathed wing contains described species order animal kingdom constituting twentyfive percent known lifeforms James K Liebherr Joseph V McHugh Resh V H R CardÃ Editors 2003 Encyclopedia Insects Academic Press Forty percent described insect species beetles 350000 species new species frequently discovered Estimates put total number species described undescribed 5 8 million
2377,Beetles found almost habitats known occur sea polar regions interact ecosystems several ways often feed plants fungi break animal plant debris eat invertebrates species prey various animals including birds mammals Certain species agricultural pests Colorado potato beetle Leptinotarsa decemlineata boll weevil Anthonomus grandis red flour beetle Tribolium castaneum mungbean cowpea beetle Callosobruchus maculatus species beetles important controls agricultural pests example coccinellidae ladybirds ladybugs consume aphids scale insects thrips plantsucking insects damage crops
2378,name Coleoptera given Aristotle hardened shield like forewings coleo shield ptera wing
2379,cockchafer elytra raised exposing membranous flight wings veins visible
2380,Trogodendron fasciculatum clerid beetle bright yellow antennae
2381,characters group believed monophyletic include holometabolous life cycle prothorax distinct freely articulating mesothorax meso metathoracic segments fusing form pterothorax depressed body shape legs ventral surface coxae legs recessed cavities formed heavily sclerotized thoracic sclerites abdominal sternites sclerotized tergites antennae 11 fewer segments terminal genitalic appendages retracted abdomen invisible rest
2382,general anatomy beetles quite uniform although specific organs appendages may vary greatly appearance function many families order Like insects beetles bodies divided three sections head thorax abdomen viewed thorax part three pairs legs pairs wings arise abdomen everything posterior thorax viewed beetles appear three clear sections deceptive beetles upper surface middle section hard plate called pronotum front part thorax back part thorax concealed beetles wings Like arthropods beetles segmented organisms three major sections body composed several segments although always readily discernible segmentation usually best seen abdomen
2383,Beetles generally characterised particularly hard exoskeleton hard forewings elytra beetles exoskeleton made numerous plates called sclerites separated thin sutures design creates armoured defences beetle maintaining flexibility elytra used flight tend cover hind part body protect second pair wings alae elytra must raised order move hind flight wings beetles flight wings crossed veins folded landing often along veins stored elytra
2384,beetles ability fly lost include ground beetles family Carabidae true weevils family Curculionidae also desert cavedwelling species families Many species two elytra fused together forming solid shield abdomen families ability fly elytra lost best known example glowworms family Phengodidae females larviform throughout lives
2385,Beetles mouthparts similar grasshoppers parts commonly known probably mandibles appear large pincers front beetles mandibles pair hard often toothlike structures move horizontally grasp crush cut food enemies see defence Two pairs fingerlike appendages found around mouth beetles serving move food mouth maxillary labial palpi
2386,eyes compound may display remarkable adaptability case whirligig beetles family Gyrinidae eyes split allow view waterline species also divided eyes â longhorn beetles family Cerambycidae weevils â many beetles eyes notched degree beetle genera also possess ocelli small simple eyes usually situated farther back head vertex
2387,Beetles antennae primarily organs smell may also used feel beetles environment physically may also used families mating among beetles defence Antennae vary greatly form within Coleoptera often similar within given family cases males females species different antennal forms Antennae may clavate flabellate lamellate subforms clavate clubbed antennae filiform geniculate moniliform pectinate serrate images antennal forms see antenna biology
2388,Acilius sulcatus diving beetle showing hind legs adapted life water
2389,legs multisegmented end two five small segments called tarsi Like many insect orders beetles bear claws usually one pair end last tarsal segment leg beetles use legs walking legs may variously modified adapted uses Among aquatic families â Dytiscidae Haliplidae many species Hydrophilidae others â legs notably last pair modified swimming often bear rows long hairs aid purpose beetles fossorial legs widened often spined digging Species adaptations found among scarabs ground beetles clown beetles family Histeridae hind legs beetles flea beetles within Chrysomelidae flea weevils within Curculionidae enlarged designed jumping
2390,Oxygen obtained via tracheal system Air enters series tubes along body openings called spiracles taken increasingly finer fibres Pumping movements body force air system
2391,Beetles haemolymph instead blood open circulatory system beetle powered tubelike heart attached top inside thorax
2392,Scarabaeiform larva cockchafer Melolontha melolontha
2393,Beetles endopterygotes complete metamorphosis
2394,single female may lay several dozen several thousand eggs lifetime Eggs usually laid according substrate larva feed upon hatching Among others laid loose substrate eg flour beetle laid clumps leaves eg Colorado potato beetle individually attached eg mungbean beetle seed borers buried medium eg carrot weevil
2395,larva usually principal feeding stage beetle life cycle Larvae tend feed voraciously emerge eggs feed externally plants certain leaf beetles others feed within food sources Examples internal feeders Buprestidae longhorn beetles larvae many beetle families predatory like adults ground beetles ladybirds rove beetles larval period varies species long several years
2396,Beetle larvae differentiated insect larvae hardened often darkened head presence chewing mouthparts spiracles along sides body Like adult beetles larvae varied appearance particularly beetle families Beetles whose larvae somewhat flattened highly mobile ground beetles rove beetles others larvae described campodeiform beetle larvae resemble hardened worms dark head capsules minute legs elateriform larvae found click beetle Elateridae darkling beetle Tenebrionidae families elateriform larvae click beetles known wireworms Beetles families Scarabaeoidea short thick larvae described scarabaeiform commonly known grubs
2397,beetle larvae go several instars developmental stages moult many species larvae simply increase size successive instar food consumed cases however dramatic changes occur Among certain beetle families genera particularly exhibit parasitic lifestyles first instar planidium highly mobile order search host following instars sedentary remain within host known hypermetamorphosis examples include blister beetles family Meloidae rove beetles particularly genus Aleochara
2398,endopterygotes beetle larvae pupate pupa emerges fully formed sexually mature adult beetle imago Adults extremely variable lifespan weeks years depending species
2399,Beetles mating San Francisco
2400,Flamboyant flower beetle Eudicella gralli forests Central Africa iridescent elytra used marriage ceremonies
2401,Beetles may display extremely intricate behaviour mating Smell thought important location mate
2402,Conflict play part mating rituals species burying beetles genus Nicrophorus conflicts males females rage one left thus ensuring reproduction strongest fittest Many beetles territorial fiercely defend small patch territory intruding males
2403,Pairing generally short cases last several hours pairing sperm cells transferred female fertilise egg
2404,Parental care varies species ranging simple laying eggs leaf certain scarab beetles construct underground structures complete supply dung house feed young beetles leaf rollers biting sections leaves cause curl inwards laying eggs thus protected inside
2405,Brachinus sp bombardier beetle
2406,Beetles larvae variety strategies avoid attacked predators parasitoids include camouflage mimicry toxicity active defence
2407,Camouflage involves use colouration shape blend surrounding environment Among exhibit defensive strategy leaf beetles family Chysomelidae green colouring similar habitat plant leaves complex camouflage also occurs weevils various coloured scales hairs cause beetle resemble bird dung
2408,Another defence often uses colour shape deceive potential enemies mimicry number longhorn beetles family Cerambycidae bear striking resemblance wasps fools predators keeping distance even though beetles fact harmless defence found lesser extent beetle families scarab beetles Beetles may combine colour mimicry behavioural mimicry acting like wasps already closely resemble
2409,Many beetle species including ladybirds blister beetles secrete distasteful toxic substances make unpalatable even poisonous species often exhibit aposematism bright contrasting colour patterns warn away potential predators
2410,Large ground beetles longhorn beetles may go attack using strong mandibles forcibly persuade predator seek easier prey Others bombardier beetles within Carabidae spray acidic gas abdomen repel predators
2411,Besides abundant varied Coleoptera able exploit wide diversity food sources available many habitats generalists eating plants animals beetles highly specialised diet Many species leaf beetles longhorn beetles weevils host specific feeding single species plant Ground beetles rove beetles family Staphylinidae among others primarily carnivorous catch consume many arthropods small prey earthworms snails predatory beetles generalists species specific prey requirements preferences
2412,Decaying organic matter primary diet many species range dung consumed coprophagous species certain scarab beetles family Scarabaeidae dead animals eaten necrophagous species carrion beetles family Silphidae beetles found within dung carrion fact predatory clown beetles preying larvae coprophagous necrophagous insects
2413,Aquatic beetles use several techniques retaining air beneath waters surface Beetles family Dytiscidae hold air abdomen elytra diving Hydrophilidae hairs surface retain layer air bodies Adult crawling water beetles use elytra hind coxae basal segment back legs air retention whirligig beetles simply carry air bubble whenever dive
2414,Sphaerius acaroides member small suborder Myxophaga
2415,authorities believe modern beetles began 140 million years ago research announced 2007 showed beetles may entered fossil record Lower Permian 265 300 million years ago Modern Beetles Predate Dinosaurs Dave Mosher LiveSciencecom 26 December 2007
2416,four extant suborders beetle
2417,Polyphaga largest suborder containing 300000 described species 170 families including rove beetles Staphylinidae scarab beetles Scarabaeidae blister beetles Meloidae stag beetles Lucanidae true weevils Curculionidae beetles identified cervical sclerites hardened parts head used points attachment muscles absent suborders
2418,Adephaga contains 10 families largely predatory beetles includes ground beetles Carabidae Dytiscidae whirligig beetles Gyrinidae beetles testes tubular first abdominal sternum plate exoskeleton divided hind coxae basal joints beetles legs
2419,Archostemata contains four families mainly woodeating beetles including reticulated beetles Cupedidae telephonepole beetle
2420,Myxophaga contains 100 described species four families mostly small including Hydroscaphidae genus Sphaerius
2421,suborders diverged Permian Triassic phylogenetic relationship uncertain popular hypothesis Polyphaga Myxophaga closely related Adephaga sister group two Archostemata sister three collectively
2422,350000 species beetles large number species poses special problems classification families consisting thousands species needing division subfamilies tribes
2423,Colorado potato beetle Leptinotarsa decemlineata larvae
2424,Many agricultural forestry household insect pests beetles include following
2425,Colorado potato beetle Leptinotarsa decemlineata notorious pest potato plants Crops destroyed beetle treated employing expensive pesticides many begun develop resistance well potatoes suitable hosts number plants potato family Solanaceae nightshade tomato aubergine capsicum
2426,boll weevil Anthonomus grandis cost cotton producers United States billions dollars since first entered country
2427,bark beetles Hylurgopinus rufipes Scolytus multistriatus elm leaf beetle Pyrrhalta luteola beetles attack elm trees bark beetles important elm pests carry Dutch elm disease move infected breeding sites feed healthy elm trees spread fungus beetle led devastation elm trees many parts Northern Hemisphere notably Europe North America
2428,death watch beetle Xestobium rufovillosum family Anobiidae considerable importance pest older wooden buildings Great Britain attacks hardwoods oak chestnut always fungal decay taken taking place thought actual introduction pest buildings takes place time construction
2429,Coccinella septempunctata beneficial beetle
2430,larvae adults ladybirds family Coccinellidae found aphid colonies lady beetles feed scale insects mealybugs normal food sources scarce may feed things small caterpillars young plant bugs honeydew nectar
2431,Ground beetles family Carabidae common predators many different insects arthropods including fly eggs caterpillars wireworms others
2432,Plantfeeding beetles often important beneficial insects controlling problem weeds flea beetles genus Aphthona feed leafy spurge considerable weed rangeland western North America
2433,farmers develop beetle banks foster provide cover beneficial beetles
2434,Beetles Dermestidae family often used taxidermy clean bones remaining flesh
2435,Ancient Egyptian scene depicting scarab beetle
2436,Several species dung beetle notably Scarabaeus sacer often referred scarab enjoyed sacred status among ancient Egyptians creatures likened major god Khepri scholars suggest Egyptians practice making mummies inspired brooding process beetle Many thousands amulets stamp seals excavated depict scarab many artifacts scarab depicted pushing sun along course sky much scarabs push roll balls dung brood sites following New Kingdom scarab amulets often placed heart mummified deceased
2437,tribal groups particularly tropical parts world use colourful iridescent elytra certain beetles especially certain Scarabaeidae ceremonies adornment
2438,Beetle collection Melbourne Museum Australia
2439,study beetles called coleopterology practitioners coleopterists Coleopterists formed organisations facilitate study beetles Among Coleopterists Society international organisation based United States organisations may professionals amateurs interested beetles members
2440,Research field often published peerreviewed journals specific field coleopterology though journals dealing general entomology also publish many papers various aspects beetle biology journals specific beetle research
2441,thriving industry collection beetle specimens amateur professional collectors Many coleopterists prefer collect beetle specimens recording detailed information specimen habitat collections add body knowledge Coleoptera countries established laws governing prohibiting collection certain rare often much sought species One beetle whose collection illegal restricted American burying beetle Nicrophorus americanus
