,Passage
804,British naturalist Alfred Wallace described dividing line distribution Indonesias Asian Australasian species Known Wallace Line runs roughly northsouth along edge Sunda Shelf Kalimantan Sulawesi along deep Lombok Strait Lombok Bali West line flora fauna Asian moving east Lombok increasingly Australian 1869 book Malay Archipelago Wallace described numerous species unique surrounding area termed Wallacea
805,Indonesias high population rapid industrialization present serious environmental issues often given lower priority due high poverty levels weak underresourced governance Issues include largescale deforestation much illegal related wildfires causing heavy smog parts western Indonesia Malaysia Singapore overexploitation marine resources environmental problems associated rapid urbanization economic development including air pollution traffic congestion garbage management reliable water waste water services Habitat destruction threatens survival indigenous endemic species including 140 species mammals identified World Conservation Union IUCN threatened 15 identified critically endangered including Sumatran Orangutan
806,Using water buffalo plough rice fields Java Agriculture countrys largest employer centuries
807,Indonesias estimated Gross Domestic Product GDP 2007 US408 billion US1038 bn PPP 2007 estimated nominal per capita GDP US1812 per capita GDP PPP US4616 International Dollars services sector economys largest accounts 453 GDP 2005 followed industry 407 agriculture 140 However agriculture employs people sectors accounting 443 95 millionstrong workforce followed services sector 369 industry 188 Major industries include petroleum natural gas textiles apparel mining Major agricultural products include palm oil rice tea coffee spices rubber
808,Indonesias main export markets Japan 223 Indonesian exports 2005 United States 139 China 91 Singapore 89 major suppliers imports Indonesia Japan 180 China 161 Singapore 128 2005 Indonesia ran trade surplus export revenues US8364 billion import expenditure US6202 billion country extensive natural resources including crude oil natural gas tin copper gold Indonesias major imports include machinery equipment chemicals fuels foodstuffs
809,Jakarta capital Indonesia largest commercial center
810,1960s economy deteriorated drastically result political instability young inexperienced government illdisciplined economic nationalism resulted severe poverty hunger time Sukarnos downfall mid1960s economy chaos 1000 annual inflation shrinking export revenues crumbling infrastructure factories operating minimal capacity negligible investment Schwarz 1994 pages 52â57 Following President Sukarnos downfall mid1960s New Order administration brought degree discipline economic policy quickly brought inflation stabilized currency rescheduled foreign debt attracted foreign aid investment Schwarz 1994 pages 52â57 Indonesia Southeast Asias member OPEC 1970s oil price raises provided export revenue windfall contributed sustained high economic growth rates averaging 7 1968 1981 Schwarz 1994 pages 52â57 Following reforms late 1980s
811,Following slowing growth 1980s due regulation dependence declining oil prices growth slowed average 43 per annum 1981 1988 range economic reforms introduced late 1980s Reforms included managed devaluation rupiah improve export competitiveness deregulation financial sector Schwarz 1994 pages 52â57 foreign investment flowed Indonesia particularly rapidly developing exportorientated manufacturing sector 1989 1997 Indonesian economy grew average 7 Schwarz 1994 pages 52â57
812,Indonesia country hardest hit East Asian financial crisis 1997â98 US dollar currency dropped Rp 2000 Rp 18000 economy shrunk 137 rupiah since stabilized around Rp 10000 slow significant economic recovery Political instability since 1998 slow economic reform corruption levels government business contributed patchy nature recovery subsequent correction Transparency International example ranked Indonesia 143rd 180 countries 2007 Corruption Perceptions Index GDP growth however exceeded 5 2004 2005 forecast increase growth rate however enough make significant impact unemployment subsequent correction stagnant wages growth increases fuel rice prices worsened poverty levels 2005 Government forced reduce large subsidies fuel prices drastically international oil prices climbed major contributor inflation hardship
813,2006 estimated 178 population live poverty line 490 population live less US2 per day
814,national population 2000 national census 206 million Indonesian Central Statistics Bureau Statistics Indonesia estimate population 222 million 2006 130 million people live island Java worlds populous island Despite fairly effective family planning program place since 1960s population expected grow around 315 million 2035 based current estimated annual growth rate 125
815,Minangkabau woman traditional dress
816,Indonesians descendant Austronesianspeaking peoples originated Taiwan major grouping Melanesians inhabit eastern Indonesia Taylor 2003 pages 5â7 around 300 distinct native ethnicities Indonesia 742 different languages dialects largest Javanese comprise 42 population politically culturally dominant Sundanese ethnic Malays Madurese largest nonJavanese groups Small significant populations ethnic Chinese Indians Europeans Arabs concentrated mostly urban areas sense Indonesian nationhood exists alongside strongly maintained regional identities Ricklefs 1991 page 256 Society largely harmonious although social religious ethnic tensions triggered horrendous violence Domestic migration including official Transmigrasi program cause violence massacre hundreds Madurese local Dayak community West Kalimantan conflicts Maluku Central Sulawesi parts Papua West Papua Kyoto University Sulawesi Kaken Team Center Southeast Asian Studies Chinese Indonesians influential ethnic minority comprising less 2 population Much countrys privatelyowned commerce wealth Chinesecontrolled Schwarz 1994 pages 53 80â81 Friend 2003 pages 85â87 164â165 233â237 contributed considerable resentment even antiChinese violence riots Jakarta 1998 much aimed Chinese part expressions resentment
817,official national language Indonesian universally taught schools spoken nearly every Indonesian language business politics national media education academia originally lingua franca region including presentday Malaysia thus closely related Malay Indonesian first promoted nationalists 1920s declared official language independence 1945 Indonesians speak least one several hundred local languages bahasa daerah often first language Javanese widelyspoken language largest ethnic group World Factbook Retrieved August 14 2007 hand Papua 500 indigenous Papuan Austronesian languages region 27 million people
818,Medans Masjid Raya Great Mosque Indonesia worlds largest Muslim population
819,Although religious freedom stipulated Indonesian constitution government officially recognizes six religions Islam Protestantism Roman Catholicism Hinduism Buddhism Confucianism Although Islamic state Indonesia worlds populous Muslimmajority nation almost 86 Indonesians declared Muslim according 2000 census 11 population Christian roughly twothirds Protestant 2 Hindu 1 Buddhist Indonesian Hindus Balinese Buddhists modernday Indonesia ethnic Chinese Though minority religions Hinduism Buddhism remain defining influences Indonesian culture Islam first adopted Indonesians northern Sumatra 13th century influence traders became countrys dominant religion 16th century Roman Catholicism brought Indonesia early Portuguese colonialists missionaries Ricklefs 1991 pp 25 26 28 Protestant denominations largely result Dutch Calvinist Lutheran missionary efforts countrys colonial period Ricklefs 1991 pp28 62 Vickers 2005 p22 large proportion Indonesians Javanese abangan Balinese Hindus Dayak Christians practice less orthodox syncretic form religion draws local customs beliefs MagnisSuseno F 1981 Javanese Ethics WorldView Javanese Idea Good Life PT Gramedia Pustaka Utama Jakarta 1997 pp1518 ISBN 979605406X
820,Wayang kulit shadow puppet performance seen audience
821,Indonesia around 300 ethnic groups cultural differences developed centuries influenced Arabic Chinese Malay European sources Traditional Javanese Balinese dances example contain aspects Hindu culture mythology wayang kulit shadow puppet performances Textiles batik ikat songket created across Indonesia styles vary region dominant influences Indonesian architecture traditionally Indian however Chinese Arab European architectural influences significant popular sports Indonesia badminton football Liga Indonesia countrys premier football club league Traditional sports include sepak takraw bull racing Madura areas history tribal warfare mock fighting contests held caci Flores pasola Sumba Pencak Silat Indonesian martial art Sports Indonesia generally maleorientated spectator sports often associated illegal gambling
822,selection Indonesian food including Soto Ayam chicken noodle soup sate kerang shellfish kebabs telor pindang preserved eggs perkedel fritter es teh manis sweet iced tea
823,Indonesian cuisine varies region based Chinese European Middle Eastern Indian precedents Rice main staple food served side dishes meat vegetables Spices notably chili coconut milk fish chicken fundamental ingredients Compared infused flavors Vietnamese Thai food flavors Indonesia kept relatively separate simple substantial Indonesian traditional music includes gamelan keroncong Dangdut popular contemporary genre pop music draws influence Arabic Indian Malay folk music Indonesian film industrys popularity peaked 1980s dominated cinemas Indonesia although declined significantly early 1990s 2000 2005 number Indonesian films released year steadily increased
824,oldest evidence writing Indonesia series Sanskrit inscriptions dated 5th century CE Important figures modern Indonesian literature include Dutch author Multatuli criticized treatment Indonesians Dutch colonial rule Sumatrans Muhammad Yamin Hamka influential preindependence nationalist writers politicians Taylor 2003 pages 299â301 proletarian writer Pramoedya Ananta Toer Indonesias famous novelist Vickers 2005 pages 3 7 Friend 2003 pages 74 180 Many Indonesias peoples stronglyrooted oral traditions help define preserve cultural identities Media freedom Indonesia increased considerably end President Suhartos rule nowdefunct Ministry Information monitored controlled domestic media restricted foreign media TV market includes ten national commercial networks provincial networks compete public TVRI Private radio stations carry news bulletins foreign broadcasters supply programs reported 18 million users 2005 Internet usage limited minority population
825,Government
826,
827,Antoine Henri Becquerel December 15 1852 August 25 1908 French physicist Nobel laureate one discoverers radioactivity 1903 Nobel Prize Physics discovering radioactivity
828,Becquerel born Paris family including son Jean produced four generations scientists studied science Ãcole Polytechnique engineering Ãcole des Ponts et ChaussÃes 1890 married Louise DÃsirÃe Lorieux
829,1892 became third family occupy physics chair MusÃum National dHistoire Naturelle 1894 became chief engineer Department Bridges Highways
830,1896 investigating phosphorescence uranium salts Becquerel accidentally discovered radioactivity Investigating work Wilhelm Conrad RÃntgen Becquerel wrapped fluorescent substance potassium uranyl sulfate photographic plates black material preparation experiment requiring bright sunlight However prior actually performing experiment Becquerel found photographic plates fully exposed discovery led Becquerel investigate spontaneous emission nuclear radiation
831,Describing method French Academy Sciences January 24 1896 said
832,One wraps LumiÃre photographic plate bromide emulsion two sheets thick black paper plate become clouded upon exposed sun day One places sheet paper outside slab phosphorescent substance one exposes whole sun several hours one develops photographic plate one recognizes silhouette phosphorescent substance appears black negative one places phosphorescent substance paper piece money metal screen pierced cutout design one sees image objects appear negative â One must conclude experiments phosphorescent substance question emits rays pass opaque paper reduces silver salts Comptes Rendus 122 420 1896 translated Carmen Giunta Accessed September 10 2006
833,1903 shared Nobel Prize Physics Pierre Marie Curie recognition extraordinary services rendered discovery spontaneous radioactivity
834,1908 year death Becquerel elected Permanent Secretary AcadÃmie des Sciences died age 55 Le Croisic
835,SI unit radioactivity becquerel Bq named Becquerel crater Moon Becquerel crater Mars
836,Egypt Egyptian Kemet Coptic KÄmi Egyptian Arabic officially Arab Republic Egypt country North Africa includes Sinai Peninsula land bridge Asia Covering area Egypt borders Libya west Sudan south Gaza Strip Israel east northern coast borders Mediterranean Sea island Cyprus eastern coast borders Red Sea
837,Egypt one populous countries Africa great majority estimated 78 million people 2007 live near banks Nile River area arable agricultural land found large areas Sahara Desert sparsely inhabited half Egypts residents live urban areas majority spread across densely populated centers greater Cairo Alexandria major cities Nile Delta
838,Egypt famous ancient civilization worlds famous monuments including Giza pyramid complex Great Sphinx southern city Luxor contains numerous ancient artifacts Karnak Temple Valley Kings Egypt widely regarded important political cultural nation Middle East
839,One ancient Egyptian names country Kemet black land kem black derived fertile black soils deposited Nile floods distinct deshret red land desert name realized Coptic stage Egyptian language appeared early Greek Another name land riverbank names Upper Lower Egypt TaShemeaw sedgeland TaMehew northland respectively
840,Arabic modern official name Egypt Egyptian Arabic Semitic origin directly cognate Semitic words Egypt Hebrew literally meaning two straits reference dynastic separation upper lower Egypt Biblical Hebrew EMagazine January 2005 word originally connoted metropolis civilization also means country frontierland
841,English name Egypt came via Latin word derived ancient Greek word AÃgyptos adjective aigÃ½pti aigÃ½ptios borrowed Coptic gyptios kyptios Arabic back formed whence English Copt term derived Late Egyptian Hikuptah Memphis corruption earlier Egyptian name HatkaPtah meaning home ka soul Ptah name temple god Ptah Memphis Strabo provided folk etymology according AÃgyptos evolved compound meaning Aegean
842,Nile River Egypt
843,Nile site continuous human habitation since least Paleolithic era Evidence appears form artifacts rock carvings along Nile terraces desert oases 10th millennium BC culture huntergatherers fishers replaced graingrinding culture Climate changes andor overgrazing around 8000 BC began desiccate pastoral lands Egypt forming Sahara Early tribal peoples migrated Nile River developed settled agricultural economy centralized society MidantReynes BÃatrix Prehistory Egypt First Egyptians First Kings Oxford Blackwell Publishers
844,6000 BC organized agriculture large building construction appeared Nile Valley Neolithic era several predynastic cultures developed independently Upper Lower Egypt Badarian culture successor Naqada series generally regarded precursors Dynastic Egyptian civilization earliest known Lower Egyptian site Merimda predates Badarian seven hundred years Contemporaneous Lower Egyptian communities coexisted southern counterparts two thousand years remaining somewhat culturally separate maintaining frequent contact trade earliest known evidence Egyptian hieroglyphic inscriptions appeared predynastic period Naqada III pottery vessels dated 3200 BC Bard Kathryn Ian Shaw ed Oxford Illustrated History Ancient Egypt Oxford Oxford University Press 2000 p 69
845,unified kingdom founded circa 3150 BC King Menes giving rise series dynasties ruled Egypt next three millennia Egyptians subsequently referred unified country tawy meaning two lands later kemet Coptic kÄmi black land reference fertile black soil deposited Nile river Egyptian culture flourished long period remained distinctively Egyptian religion arts language customs first two ruling dynasties unified Egypt set stage Old Kingdom period c2700â2200 BC famous many pyramids notably Third Dynasty pyramid Djoser Fourth Dynasty Giza Pyramids
846,Great Sphinx Pyramids Giza built Old Kingdom modern national icons heart Egypts thriving tourism industry
847,First Intermediate Period ushered time political upheaval 150 years Stronger Nile floods stabilization government however brought back renewed prosperity country Middle Kingdom c 2040 BC reaching peak reign Pharaoh Amenemhat III second period disunity heralded arrival first foreign ruling dynasty Egypt Semitic Hyksos Hyksos invaders took much Lower Egypt around 1650 BC founded new capital Avaris driven Upper Egyptian force led Ahmose founded Eighteenth Dynasty relocated capital Memphis Thebes
848,New Kingdom c1550â1070 BC began Eighteenth Dynasty marking rise Egypt international power expanded greatest extension empire far south Jebel Barkal Nubia included parts Levant east period noted wellknown Pharaohs including Hatshepsut Thutmose III Akhenaten wife Nefertiti Tutankhamun Ramesses II first known selfconscious expression monotheism came period form Atenism Frequent contacts nations brought new ideas New Kingdom country later invaded Libyans Nubians Assyrians native Egyptians drove regained control country
849,First built third fourth century AD Hanging Church Cairos famous Coptic church
850,Thirtieth Dynasty last native ruling dynasty Pharaonic epoch fell Persians 343 BC last native Pharaoh King Nectanebo II defeated battle Later Egypt fell Greeks Romans beginning two thousand years foreign rule
851,Egypt became part Byzantine realm Christianity brought Saint Mark Evangelist AD first century Diocletians reign marked transition Roman Byzantine era Egypt great number Egyptian Christians persecuted New Testament translated Egyptian Council Chalcedon AD 451 distinct Egyptian Coptic Church firmly established Kamil Jill Coptic Egypt History Guide Cairo American University Cairo 1997 p 39
852,Byzantines able regain control country brief Persian invasion early seventh century AD 639 Egypt invaded Muslim Arabs form Islam Arabs brought Egypt Sunni Early period Egyptians began blend new faith indigenous beliefs practices survived Coptic Christianity giving rise various Sufi orders flourished day ElDaly Okasha Egyptology Missing Millennium London UCL Press 2005 p 140 Muslim rulers nominated Islamic Caliphate remained control Egypt next six centuries including period seat Caliphate Fatimids end Ayyubid dynasty Mamluks TurcoCircassian military caste took control AD 1250 continued govern even conquest Egypt Ottoman Turks 1517
853,Mosque Mohamed Ali built early nineteenth century within Cairo Citadel
854,brief French Invasion Egypt led Napoleon Bonaparte 1798 great social impact country culture Native Egyptians became exposed principles French Revolution chance exercise selfgovernance Vatikiotis PJ History Modern Egypt 4th edition Baltimore Johns Hopkins University 1992 p 39 series civil wars took place Ottoman Turks Mamluks Albanian mercenaries following evacuation French troops resulting Albanian Muhammad Ali Kavalali Mehmed Ali Pasha taking control Egypt appointed Ottoman viceroy 1805 led modernization campaign public works including irrigation projects agricultural reforms increased industrialization taken expanded grandson successor Ismail Pasha
855,Following completion Suez Canal Ismail 1869 Egypt became important world transportation trading hub 1866 Assembly Delegates founded serve advisory body government members elected across Egypt came important influence governmental affairs Jankowski James Egypt Short History Oxford Oneworld Publications 2000 p 83 country fell heavily debt European powers Ostensibly protect investments United Kingdom seized control Egypts government 1882 Egypt gave nominal allegiance Ottoman Empire 1914 result declaration war Ottoman Empire Britain declared protectorate Egypt deposed Khedive Abbas II replacing uncle Husayn Kamil appointed Sultan
856,Public riot 1919 Revolution sparked British exile nationalist leader Saad ZaghlulBetween 1882 1906 local nationalist movement independence taking shape Dinshaway Incident prompted Egyptian opposition take stronger stand British occupation first political parties founded First World War Saad Zaghlul Wafd Party led Egyptian nationalist movement gaining majority local Legislative Assembly British exiled Zaghlul associates Malta March 8 1919 country arose first modern revolution Constant revolting Egyptian people throughout country led Great Britain issue unilateral declaration Egypts independence February 22 1922 Jankowski op cit p 112
857,new Egyptian government drafted implemented new constitution 1923 based parliamentary representative system Saad Zaghlul popularlyelected Prime Minister Egypt 1924 1936 AngloEgyptian Treaty concluded
858,Continued instability government due remaining British control increasing political involvement king led ouster monarchy dissolution parliament military coup dÃtat known 1952 Revolution officers known Free Officers Movement forced King Farouk abdicate support son Fuad
859,View Cairo largest city Africa Middle East Cairo Opera House bottomright main performing arts venue Egyptian capital
860,June 18 1953 Egyptian Republic declared General Muhammad Naguib first President Republic Naguib forced resign 1954 Gamal Abdel Nasser real architect 1952 movement later put house arrest Nasser assumed power President declared full independence Egypt United Kingdom June 18 1956 nationalization Suez Canal July 26 1956 prompted 1956 Suez Crisis
861,Three years 1967 Six Day War Israel invaded occupied Sinai Nasser died succeeded Anwar Sadat Sadat switched Egypts Cold War allegiance Soviet Union United States expelling Soviet advisors 1972 launched Infitah economic reform policy violently clamping religious secular opposition alike
862,1973 Egypt along Syria launched October War surprise attack Israeli forces occupying Sinai Peninsula Golan Heights attempt liberate territory Israel captured 6 years earlier US USSR intervened ceasefire reached Despite complete military success historians agree October War presented Sadat political victory later allowed pursue peace Israel
863,1977 Sadat made historic visit Israel led 1979 peace treaty exchange complete Israeli withdrawal Sinai Sadats initiative sparked enormous controversy Arab world led Egypts expulsion Arab League supported vast majority Egyptians Vatikiotis p 443 fundamentalist military soldier assassinated Sadat Cairo 1981 succeeded incumbent Hosni Mubarak 2003 Egyptian Movement Change popularly known Kifaya launched seek return democracy greater civil liberties
864,Mahmoud Mokhtars Egypts Renaissance 19191928 Cairo University
865,Egyptian Nile Valley home one oldest cultures world spanning three thousand years continuous history Egypt fell series foreign occupations 343 BC left indelible mark countrys cultural landscape Egyptian identity evolved span long period occupation accommodate principle two new religions Christianity Islam new language Arabic spoken descendant Egyptian Arabic degree different groups Egypt identify factors articulating sense collective identity vary
866,Questions identity came fore last century Egypt sought free foreign occupation first time two thousand years Three chief ideologies came head ethnoterritorial Egyptian nationalism extension Pharaonism secular Arab nationalism panArabism Islamism Egyptian nationalism predates Arab counterpart many decades roots nineteenth century becoming dominant mode expression Egyptian anticolonial activists pre interwar periods nearly always articulated exclusively Egyptian terms
867,1931 following visit Egypt Syrian Arab nationalist Sati alHusri remarked Egyptians possess Arab nationalist sentiment accept Egypt part Arab lands would acknowledge Egyptian people part Arab nation qtd Dawisha Adeed Arab Nationalism Twentieth Century Princeton University Press 2003 p 99 later 1930s would become formative period Arab nationalism Egypt large part due efforts SyrianPalestinianLebanese intellectuals Jankowski Egypt Early Arab Nationalism p 246 Nevertheless year establishment League Arab States 1945 headquartered Cairo Oxford University historian H Deighton still writing
868,Nasser era decade later Arab nationalism became state policy means define Egypts position Middle East world Nasser Egypt ruled Britain since 1882 favor territorial Egyptian nationalism distant panArab ideology Egyptians generally identify Arabs revealing Egyptian nationalist leader Saad Zaghlul met Arab delegates Versailles 1918 insisted struggles statehood connected claiming problem Egypt Egyptian problem Arab one Makropoulou Ifigenia Pan Arabism Destroyed Ideology Arab Nationalism Hellenic Center European Studies January 15 2007 usually articulated visÃ vis Zionism neighboring Jewish state
869,Egypt Syria formed United Arab Republic union dissolved current official name Egypt adopted Arab Republic Egypt Egypts attachment Arabism however particularly questioned defeat 1967 SixDay War Thousands Egyptians lost lives country become disillusioned Arab politics Dawisha p 237 Nassers successor Sadat policy peace initiative Israel revived uncontested Egyptian orientation unequivocally asserting Egypt responsibility terms Arab Arabism Arab unity save new official name became conspicuously absent Dawisha pp 26465 267 Indeed professor Egyptian history P J Vatikiotis explains
870,Egyptian Flag 1958
