,Passage
0,Uruguay official full name pron Eastern Republic Uruguay country located southeastern part South America home 33 million people 17 million live capital Montevideo metropolitan area
1,bordered Brazil north Argentina across bank Uruguay River west estuary RÃo de la Plata southwest South Atlantic Ocean southeast second smallest independent country South America larger Suriname French overseas department French Guiana
2,Montevideo founded Spanish early 18th century military stronghold Uruguay independence 1828 following threeway struggle Spain Argentina Brazil constitutional democracy president fulfills roles head state head government
3,economy largely based agriculture making 10 GDP substantial export statesector relies heavily world trade Consequently badly affected downturn global prices However economy whole stable surrounding states maintains solid reputation investors
4,According Transparency International Uruguay second least corrupt country Latin America Chile Transparencyorg political labor conditions among freest continent
5,November 2007 became first Latin American country second American Continent recognize samesex civil unions national level Uruguay Passes CivilUnion Law San Francisco Bay Times December 6 2007
6,88 population European descent twothirds population declared Roman Catholics However majority Uruguayans nominally religious CIA World Factbook Uruguay
7,name Uruguay comes GuaranÃ many possible meanings proposed meanings
8,River colorful painted chinchillas birds poetic interpretation attributed Juan Zorrilla de San MartÃn
9,River bring food anonymous version popularized since discovery old document written Jesuit Lucas Marton
10,inhabitants Uruguay European colonization area various tribes hunter gatherer native Americans well known CharrÃºa Indians small tribe driven south GuaranÃ Indians Paraguay population estimated 5000 10000 ref
11,Plaza Independencia Independence Square Montevideo hosts tomb JosÃ Artigas late leader Provincia Oriental Liga Federal front square Palacio Salvo seen
12,Europeans arrived territory presentday Uruguay year 1536 absence gold silver limited settlement region 16th 17th centuries Uruguay became zone contention Spanish Portuguese empires 1603 Spanish began introduce cattle became source wealth region ref first permanent settlement territory presentday Uruguay founded Spanish 1624 Villa Soriano southwestern coast RÃo Negro 1680 Portuguese built fort Colonia del Sacramento ref Spanish colonization increased Spain sought limit Portugals expansion Brazils frontiers
13,Another segment colonial Uruguays population consisted people African descent Colonial Uruguays African community grew number members escaped harsh treatment Buenos Aires Many relocated Montevideo larger black community seemed lest hostile politically Buenos Aires favorable climate lower humidity
14,province Viceroyalty La Plata colonial Uruguay known Banda Oriental Eastern Strip referring location east Rio Uruguay inhabitants called Easterners Orientales term still commonly use refer
15,Uruguays capital Montevideo founded Spanish early 18th century military stronghold natural harbor soon developed commercial center competing Argentinas capital Buenos Aires Uruguays early 19th century history shaped ongoing conflicts British Spanish Portuguese colonial forces dominance ArgentinaBrazilUruguay region ref 1806 1807 British army attempted seize Buenos Aires part war Spain result beginning 1807 Montevideo occupied 10000strong British force held middle year left attack Buenos Aires
16,Uruguayans road independence much longer countries Americas Early efforts attaining independence focused overthrow Spanish rule process begun Jose Gervasio Artigas 1811 led forces victory Spanish battle Las Piedras May 18 1811 1816 Portuguese troops invaded presentday Uruguay led eventual annexation Brazil 1821 provincial name Provincia Cisplatina April 19 1825 thirtythree Uruguayan exiles led Juan Antonio Lavalleja returned Buenos Aires lead insurrection Uruguay help Argentine troops known Treinta Tres Orientales actions inspired representatives Uruguay meet La Florida town recently liberated area declared independence Portugal therefore Brazil August 25 1825 Uruguayan independence recognized neighbors 1828 Britain search new commercial markets brokered peace Argentina Brazil Uruguay ref
17,RÃo de la Plata 1603
18,Uruguays politics takes place framework presidential representative democratic republic whereby President Uruguay head state head government pluriform multiparty system Executive power exercised government Legislative power vested government two chambers General Assembly Uruguay Judiciary independent executive legislature
19,Uruguays history Partido Colorado Partido Blanco alternated power Partido Blanco roots countryside original settlers Spanish origin cattle ranchers Partido Colorado roots port city Montevideo new immigrants Italian origin backing foreign interests Partido Colorado built welfare state financed taxing cattle revenue giving state pickles free services new urban immigrants became dependent state elections 2004 however brought Frente Amplio coalition socialists former Tupamaros former communists mainly social democrats among others power majorities houses parliament election President TabarÃ VÃzquez absolute majority
20,Frente Amplio displaced Partido Colorado traditional urban welfare state constituency enjoying boom export commodity prices
21,Reporters Without Borders worldwide press freedom index ranked Uruguay 57th 168 reported countries 2006 Reporters Without Borders Worldwide Press Freedom Index 2006
22,According Freedom House American organization tracks global trends political freedom Uruguay ranked twentyseventh Freedom World index According Economist Intelligence Unit Uruguay scores 796 Democracy Index located last position among 28 countries considered Full Democracies world report looks 60 indicators across five categories Free elections civil liberties functioning government political participation political culture Economist world 2007 Pause democracys march Page 93
23,Uruguay ranks 28th World CPI Corruption Perception Index composed Transparency International
24,Uruguayan constitution allows citizens challenge laws approved Parliament use Referendum propose changes Constitution use Plebiscite last 15 years method used several times confirm amnesty members military violated human rights military regime 19731985 stop privatization public utilities companies See Economy Public Sector defend pensioners incomes protect water resources
25,176214 square kilometres 68036 square miles continental land 142199 square kilometres 54903 sq mi jurisdictional waters small river islands Instituto Nacional Estadistica Uruguay second smallest sovereign nation South America Suriname third smallest territory French Guiana smallest landscape features mostly rolling plains low hill ranges cuchillas fertile coastal lowland dense fluvial network covers country consisting four river basins deltas RÃo de la Plata Uruguay River Laguna MerÃn RÃo Negro major internal river RÃo Negro black river Several lagoons found along Atlantic coast
26,highest point country Cerro Catedral 51366 meters 1685 ft 3 Sierra de CarapÃ mountain range southwest RÃo de la Plata estuary Uruguay River forms western border ParanÃ River run Uruguay
27,Uruguay consists nineteen departments singular first departments formed 1816 newest date 1885 Flores departments governed intendente municipal elected five years members Departmental Assembly form legislative level department
28,Map Uruguay
29,Uruguay shares borders two countries Argentina
30,Brazil
31,climate Uruguay temperate warm summers cold winters predominantly gently undulating landscape also somewhat vulnerable rapid changes weather fronts
32,receives periodic influence polar air winter tropical air Brazil summer Without mountains zone act barrier air masses freely move territory causing abrupt weather changes
33,coolest month June warmest January rainfall equally distributed throughout year tends bit frequent autumn months frequent thunderstorms summer Although snow common snowed 1913 1918 1963 1989 1992 2007
34,Playa Brava Punta del Este Uruguay
35,Since 1984 Uruguay Antarctic base General Artigas King George Island Antarctica part South Shetland Islands archipelago 100 km 62 mi Antarctic peninsula
36,Montevideo Uruguays capital
37,Uruguay middle income economy mainly dominated State services sector exportoriented agricultural sector industrial sector Uruguay relies heavily trade particularly agricultural exports leaving country particularly vulnerable slumps commodity prices global economic slowdowns averaging growth 5 annually 19961998 19992001 economy suffered lower demand Argentina Brazil together account nearly half Uruguays exports Despite severity trade shocks Uruguays financial indicators remained stabler neighbours reflection solid reputation among investors investmentgrade sovereign bond rating â one two South America Aboutcom Go South America based information CIA World Factbook recent years Uruguay shifted energy developing commercial use technologies become first exporter software Latin America Diego Stewart Building Uruguay exports architectural services India Latin America Latin Trade May 2005 Retrieved August 11 2007
38,parts economy appeared resilient downturn severe impact local population Unemployment levels rose 20 real wages fell peso devalued worsening economic conditions played part turning public opinion mildly free market economic policies adopted previous administrations 1990s leading popular rejection proposals privatization state petroleum company 2003 state water company 2004 newly elected Frente Amplio government pledging continue payments Uruguays external debt Michael Fox Uruguays Frente Amplio Revolution Dilution June 19 2007 Retrieved August 11 2007 also promised undertake Emergency Plan See sectionSocial Problems Poverty inequality attack widespread problems poverty unemployment See leaders President Tabare Vazquez taking office announced 100m emergency plan help poor
39,Agriculture played important part Uruguayan history national identity middle twentieth century entire country sometimes likened single huge estancia agricultural estate centred around Montevideo wealth generated hinterland spent casco administrative head
40,heartland historic estancias Estancia San Eugenio CasupÃ southern department Florida
41,Today agriculture contributes roughly 10 countryâs GDP still main foreign exchange earner putting Uruguay line agricultural exporters like Brazil Canada New Zealand Uruguay member Cairns Group exporters agricultural products Uruguayâs agriculture relatively low inputs labour technology capital comparison countries results comparatively lower yields per hectare also opens door Uruguay market products natural ecological
42,Campaigns like âUruguayan grassfed beefâ âUruguay Naturalâ aim establish Uruguay premium brand beef wine food products
43,Recently industry developed around estancia tourism capitalizes traditional folkloristic connotations associated gaucho culture remaining resources Uruguays historic estancias
44,Approximately 88 population prevalently white European descent Spaniards followed closely Italians French Germans Portuguese British Swiss Russians Poles Bulgarians Hungarians Ukrainians Lithuanians Estonians Latvians Dutch Belgians Croatians Greeks Scandinavians Irish Armenians 08 Mestizo
45,remaining AfroLatin American ancestry ref
46,INE Spanish
47,Many European immigrants arrived Uruguay late 1800s heavily influenced architecture culture Montevideo major cities reason Montevideo life within city reminiscent parts Europe example Barcelona Thessaloniki TelAviv said similar Montevideo different aspects ref
48,colonies Colonia Valdense Waldensian colony Colonia Suiza also named Nueva Helvecia mainly Swiss colony German Austrian settlers founded department Colonia also towns founded early British settlers like Conchillas Barker Russian colony called San Javier found department RÃo Negro Mennonite colonies also found department RÃo Negro department Canelones One called El OmbÃº famous wellknown Dulce de Leche Claldy located near city Young
49,Uruguay large urban middle class literacy rate 9679 1996 est ref 1970s 1980s estimated 600000 Uruguayans emigrated mainly Spain Italy Argentina Brazil Uruguayans went various countries Europe USA Australia
50,birth rate 1673 births1000 population Brazil 1656 births1000 population ref
51,Uruguays oldest church San Carlos Maldonado
52,Church state officially separated since approximately 1916 Uruguayans adhere Roman Catholic faith 62 smaller Protestant 4 Jewish 3 well large nonprofessing group 31
53,Although majority Uruguayans actively practice religion nominally church members Catholic Protestant Jewish communities widely considered secular nation Latin America
54,According data published United Nations Gini index Uruguay equals 448 2003 100 stands maximum inequality 0 even distribution wealth population
55,recent report compiled published National Statistics Institute Instituto Nacional de Estadistica Uruguay used 2 indicators estimate number people living poverty country
56,Indigence line income family enough basic food consumption
57,Poverty line income family enough food consumption clothing health transport
58,numbers obtained depends according methodology used inform uses 3 different methods According one proposed Regional Workshop poverty measurement 1996 produces highest values results first quarter 2006
59,Population Indigence line 301
60,Population Poverty line 18
61,reports shows indicators improving country recovering last 2002 crisis 2004 poverty indicators reached time high ref
62,new ministry Social Development created Broad Front Uruguay Frente Amplio government led Tabare Vazquez Emergency plan targets less favoured 200000 Uruguayans
63,average income woman 2002 Uruguay 718 income men activity ref average income African heritage workers 65 European heritage ref
64,Montevideo capital country view pedestrian street Ciudad Vieja former Spanish citadel
65,Although rents neighborhoods high demand expensive Uruguay usually required another property warranty contract leave deposit many afford
66,first condition makes renting property especially difficult least favoured sectors population According INE 23 3 population lives place neither owned rented proper built houses others precarious constructions built illegally public private empty land outside cities Thus whole new poor neighborhoods emerged last decades called Asentamientos colloquially Cantegriles ironic allusion fashionable Neighborhood Cantegril Punta del Este
67,phenomena similar Favelas Brazil
68,Villas Miseria Argentina Barrios Venezuela Arrabales Spain Poblaciones Callampa Chile Jacales Mexico
69,main sport Uruguay football Uruguay national football team one five nations win FIFA World Cup two occasions 1930 Uruguay hosted first ever World Cup went win competition defeating Argentina 42 final Uruguay 1950 FIFA World Cup well famously defeating favored hosts Brazil 21 final Uruguay far smallest country population wise win World Cup World Cup winners nation second smallest population Argentina winners 1978 1986 editions currently 40000000 people according latest estimate 2002 census Uruguays current population slightly 3400000 Uruguay national team also Copa AmÃrica 14 different times record shares Argentina
70,Basketball rugby union tennis popular sports Uruguay
71,Political economic rankings
72,Health rankings
73,rankings
74,Michael Faraday FRS September 22 1791 â August 25 1867 English chemist physicist natural philosopher terminology time contributed fields electromagnetism electrochemistry
75,Faraday studied magnetic field around conductor carrying DC electric current established basis magnetic field concept physics discovered electromagnetic induction diamagnetism electrolysis established magnetism could affect rays light underlying relationship two phenomena Michael Faraday entry 1911 Encyclopaedia Britannica hosted LovetoKnow Retrieved January 2007 Institution Engineering Technology London Archives Michael Faraday inventions electromagnetic rotary devices formed foundation electric motor technology largely due efforts electricity became viable use technology
76,chemist Faraday discovered benzene investigated clathrate hydrate chlorine invented early form bunsen burner system oxidation numbers popularized terminology anode cathode electrode ion
77,Although Faraday received little formal education knew little higher mathematics calculus one influential scientists history historians science refer best experimentalist history science best experimentalist history science Quoting Dr Peter Ford University Bathâs Department Physics Accessed January 2007 SI unit capacitance farad named Faraday constant charge mole electrons 96485 coulombs Faradays law induction states magnetic field changing time creates proportional electromotive force
78,Faraday first foremost Fullerian Professor Chemistry Royal Institution Great Britain position appointed life
79,Michael Faraday photograph John Watkins British Library
80,Michael Faraday born Newington Butts near presentday South London England family well father James member Sandemanian sect Christianity James Faraday come London ca 1790 Outhgill Westmorland village blacksmith young Michael Faraday one four children basic school educations largely educate Michael Faraday History Science Technology Houghton Mifflin Company 2004 Answerscom 4 June 2007 ref fourteen became apprenticed local bookbinder bookseller George Riebau sevenyear apprenticeship read many books including Isaac Watts Improvement Mind enthusiastically implemented principles suggestions contained therein developed interest science specifically electricity particular inspired book Conversations Chemistry Jane Marcet
81,age twenty 1812 end apprenticeship Faraday attended lectures eminent English chemist physicist Humphry Davy Royal Institution Royal Society John Tatum founder City Philosophical Society Many tickets lectures given Faraday William Dance one founders Royal Philharmonic Society Afterwards Faraday sent Davy three hundred page book based notes taken lectures Davys reply immediate kind favorable Davy damaged eyesight accident nitrogen trichloride decided employ Faraday secretary John Payne one Royal Institutions assistants fired Sir Humphry Davy asked find replacement appointed Faraday Chemical Assistant Royal Institution March 1
82,classbased English society time Faraday considered gentleman Davy went long tour continent 18135 valet wish go Faraday going Davys scientific assistant asked act Davys valet replacement could found Paris Davy failed find replacement Faraday forced fill role valet well assistant throughout trip Davys wife Jane Apreece refused treat Faraday equal making travel outside coach eat servants etc generally made Faraday miserable contemplated returning England alone giving science altogether trip however give access European scientific elite host stimulating ideas
83,sponsor mentor John Mad Jack Fuller created Fullerian Professorship Chemistry Royal Institution
84,Faraday devout Christian member small Sandemanian denomination offshoot Church Scotland later served two terms elder groups church
85,Faraday married Sarah Barnard 18001879 June 2 1821 although would never children met attending Sandemanian church
86,elected member Royal Society 1824 appointed director laboratory 1825 1833 appointed Fullerian professor chemistry institution life without obligation deliver lectures
87,title page Chemical History Candle 1861
88,Faradays earliest chemical work assistant Davy made special study chlorine discovered two new chlorides carbon also made first rough experiments diffusion gases phenomenon first pointed John Dalton physical importance fully brought light Thomas Graham Joseph Loschmidt succeeded liquefying several gases investigated alloys steel produced several new kinds glass intended optical purposes specimen one heavy glasses afterwards became historically important substance Faraday detected rotation plane polarisation light glass placed magnetic field also substance first repelled poles magnet also endeavoured success make general methods chemistry distinguished results subject special study popular exposition
89,invented early form become Bunsen burner used almost universally science laboratories convenient source heat See page 127 Faradays Chemical Manipulation Instructions Students Chemistry 1827
90,Faraday worked extensively field chemistry discovering chemical substances benzene called bicarburet hydrogen inventing system oxidation numbers liquefying gases chlorine 1820 Faraday reported first syntheses compounds made carbon chlorine C 2 H 6 C 2 H 4 published results following year Faraday also determined composition chlorine clathrate hydrate discovered Humphry Davy 1810
91,Faraday also discovered laws electrolysis popularized terminology anode cathode electrode ion terms largely created William Whewell
92,Faraday first report later came called metallic nanoparticles 1847 discovered optical properties gold colloids differed corresponding bulk metal probably first reported observation effects quantum size might considered birth nanoscience
93,Faradays greatest work probably electricity magnetism first experiment recorded construction voltaic pile seven halfpence pieces stacked together seven disks sheet zinc six pieces paper moistened salt water pile decomposed sulphate magnesia first letter Abbott July 12 1812
94,ImageFaraday photograph iijpgthumb200pxleftMichael Faraday holding glass bar type used 1845 show magnetism affect light Detail engraving Henry Adlard based earlier photograph Maull Polyblank ca 1857 See National Portrait Gallery UK
95,1821 soon Danish physicist chemist Hans Christian Ãrsted discovered phenomenon electromagnetism Davy British scientist William Hyde Wollaston tried failed design electric motor Faraday discussed problem two men went build two devices produce called electromagnetic rotation continuous circular motion circular magnetic force around wire wire extending pool mercury magnet placed inside would rotate around magnet supplied current chemical battery latter device known homopolar motor experiments inventions form foundation modern electromagnetic technology Faraday published results without acknowledging debt Wollaston Davy resulting controversy caused Faraday withdraw electromagnetic research several years
96,stage also evidence suggest Davy may trying slow Faradayâs rise scientist natural philosopher known 1825 instance Davy set onto optical glass experiments progressed six years great results Davys death 1829 Faraday stopped fruitless tasks moved endeavors worthwhile Two years later 1831 began great series experiments discovered electromagnetic induction Joseph Henry likely discovered selfinduction months earlier may anticipated work Francesco Zantedeschi Italy 1829 1830
97,Faradays breakthrough came wrapped two insulated coils wire around massive iron ring bolted chair found upon passing current one coil momentary current induced coil phenomenon known mutual induction iron ringcoil apparatus still display Royal Institution subsequent experiments found moved magnet loop wire electric current flowed wire current also flowed loop moved stationary magnet demonstrations established changing magnetic field produces electric field relation mathematically modelled Faradays law subsequently became one four Maxwell equations turn evolved generalization known today field theory
98,Michael Faraday statue Savoy Place London
99,Sculptor John Henry Foley RA
100,Faraday later used principle construct electric dynamo ancestor modern power generators
101,1839 completed series experiments aimed investigating fundamental nature electricity Faraday used static batteries animal electricity produce phenomena electrostatic attraction electrolysis magnetism etc concluded contrary scientific opinion time divisions various kinds electricity illusory Faraday instead proposed single electricity exists changing values quantity intensity voltage charge would produce different groups phenomena
102,Near end career Faraday proposed electromagnetic forces extended empty space around conductor idea rejected fellow scientists Faraday live see idea eventually accepted Faradays concept lines flux emanating charged bodies magnets provided way visualize electric magnetic fields mental model crucial successful development electromechanical devices dominated engineering industry remainder 19th century
103,1845 discovered phenomenon named diamagnetism called Faraday effect plane polarization linearly polarized light propagated material medium rotated application external magnetic field aligned propagation direction wrote notebook last succeeded illuminating magnetic curve line force magnetising ray light established magnetic force light related
104,work static electricity Faraday demonstrated charge resided exterior charged conductor exterior charge influence anything enclosed within conductor exterior charges redistribute interior fields due cancel shielding effect used known Faraday cage
105,Faraday excellent experimentalist conveyed ideas clear simple language However mathematical abilities extend far trigonometry simplest algebra James Clerk Maxwell took work Faraday others consolidated set equations lie base modern theories electromagnetic phenomena
106,Michael Faraday meets Father Thames Punch July 21 1855
107,Beyond scientific research areas chemistry electricity magnetism Royal Institution Faraday undertook numerous often timeconsuming service projects private enterprise British government work included investigations explosions mines expert witness court preparation highquality optical glass
